{
  "offlinePassId": "opass_a8b9c0d1e2f3",
  "offlinePass": {
    "passId": "opass_a8b9c0d1e2f3",
    "sub": "sub_9a8b7c6d",
    "deviceId": "dev_android_abc123",
    "devicePublicKey": "AnqCJkURKXFi9hQaO5EzjzvZXf8V0LCdzMg496b+y2rN",
    "keyId": "YjX5pR0TzmU3ubs17wImQQ",
    "issuedAt": "2026-02-13T09:50:00.000Z",
    "expiresAt": "2026-02-13T10:50:00.000Z",
    "policyVersion": 1,
    "revocationEpoch": 42,
    "offlineAllowance": {
      "maxTotalCredits": 200,
      "maxUses": 5,
      "maxCreditsPerTx": 50
    },
    "constraints": {
      "minIntervalSec": 60
    },
    "signatureAlgorithm": "ECDSA-P256-SHA256",
    "signature": "MEQCIHtTBR62/kj2qeB7M2BXb1yek5fh7ryc+lhz5N0sJLPNAiAHnbvbzTENpzKRSUflA/9BsgokbMZbDR1BdsxN4tZlPg=="
  },
  "counter": 5,
  "bayId": "bay_a1b2c3d4",
  "serviceId": "svc_eco",
  "requestedDurationSeconds": 300,
  "deviceProof": {
    "format": "android-key",
    "signature": "MEUCIQC/c8s3XmzC7wSuRt2ccC2T7FpYy4POjmkTzcBZmDSQrAIgabFdUqizJloOHvG22uFPX2FwOT3y/yTB44koUp8K/qM="
  },
  "transcriptHash": "QpBSk/jj/oVLzoDJRTK98jomTs6YK6ZPVydjuqjppsc="
}
