{
  "offlinePassId": "opass_a1b2c3d4e5f6",
  "offlinePass": {
    "passId": "opass_a1b2c3d4e5f6",
    "sub": "sub_user01abc",
    "deviceId": "device-iphone-14-pro-001",
    "devicePublicKey": "A+aNWTS04CWiEzjfjaEOhm0Pa/YPB572UNMlcx1ZffgT",
    "keyId": "YjX5pR0TzmU3ubs17wImQQ",
    "issuedAt": "2026-02-15T08:00:00.000Z",
    "expiresAt": "2026-02-16T08:00:00.000Z",
    "policyVersion": 1,
    "revocationEpoch": 0,
    "offlineAllowance": {
      "maxTotalCredits": 500,
      "maxUses": 3,
      "maxCreditsPerTx": 200
    },
    "constraints": {
      "minIntervalSec": 300
    },
    "signatureAlgorithm": "ECDSA-P256-SHA256",
    "signature": "MEUCIQCQobJNkoPnS/crg26Ec25LamGzfiUfLR/lLyPYVtdWTwIgWnzon0WI3eMKrOk4zxdwizLCFRDVURdkZJHvK4svVO8="
  },
  "counter": 0,
  "bayId": "bay_a1b2c3d4e5f6",
  "serviceId": "svc_basic",
  "requestedDurationSeconds": 120,
  "deviceProof": {
    "format": "apple-appattest",
    "signature": "MEUCIQC+6y5ME+thUL/N/xy8FUTArqQT5uSy2SVAp4dYoGfnlAIgf0CT+YqIWvEb0jubrrdfb4lVRfZuAg5b383uheO2fQ8=",
    "authenticatorData": "bR2vgjWJbHy80iqDVEPONZjpIUj6ilROZ2f2ESHQEDAAAAAAAQ=="
  },
  "transcriptHash": "HRFiIFInf45/+jNLmEGXHLf7sVJvLoBwcGnrjtoNerI="
}
