{
  "offlinePassId": "opass_e7f8a9b0c1d2e3f4",
  "offlinePass": {
    "passId": "opass_e7f8a9b0c1d2e3f4",
    "sub": "sub_user42xyz",
    "deviceId": "device-pixel-8-pro-042",
    "devicePublicKey": "Ahurv7k0oBBFvNCQfsnfOGAwuGqkpsdr4Z+2VPLI9uUg",
    "keyId": "YjX5pR0TzmU3ubs17wImQQ",
    "issuedAt": "2026-02-14T12:30:00.000Z",
    "expiresAt": "2026-02-15T12:30:00.000Z",
    "policyVersion": 3,
    "revocationEpoch": 7,
    "offlineAllowance": {
      "maxTotalCredits": 1000,
      "maxUses": 5,
      "maxCreditsPerTx": 300
    },
    "constraints": {
      "minIntervalSec": 600
    },
    "signatureAlgorithm": "ECDSA-P256-SHA256",
    "signature": "MEQCID778pQN3cNah5VB3WTbOosc1KuMigKRjkSe+gjKDpAbAiBq6S2ezzBbXlz5q8AzbjrncuHITr3WZ+OkV8hjO+vgzQ=="
  },
  "counter": 3,
  "bayId": "bay_f9e8d7c6b5a4",
  "serviceId": "svc_premium",
  "requestedDurationSeconds": 600,
  "deviceProof": {
    "format": "android-key",
    "signature": "MEQCIE979qITtqKNjc4EawgHCRXAHsE1roA9jdV4r1dkUEvwAiBtpj2GKdEuzRveJib6HybmNTq+8uosklxJWEdsomMeXA=="
  },
  "transcriptHash": "i61hkjBYbYJFzkUDKmZ8xD7hLzlg+u92iBHQLW3AVhM="
}
